{
  "schema_version": 1,
  "profile_revision": 1,
  "name": "couchdb",
  "description": "Apache CouchDB journal-first logging",
  "journal": true,
  "required_paths": [],
  "files": [],
  "tasks": [],
  "docker": {"enabled": false},
  "detect": {"mode": "any", "priority": 60, "probes": [{"type": "service", "value": "couchdb.service"}]},
  "test_service": "couchdb-test",
  "notes": ["Journal only; inspect local.ini before adding a file collector."]
}
