{
  "schema_version": 1,
  "profile_revision": 1,
  "name": "prowlarr",
  "description": "Prowlarr journal logging",
  "journal": true,
  "required_paths": [],
  "files": [],
  "tasks": [],
  "docker": {"enabled": false},
  "detect": {"mode": "any", "priority": 60, "probes": [{"type": "service", "value": "prowlarr.service"}]},
  "test_service": "prowlarr-test",
  "notes": ["Journal only for v1."]
}
