{
  "schema_version": 1,
  "profile_revision": 2,
  "name": "beszel",
  "description": "Beszel hub journal logging",
  "journal": true,
  "required_paths": [],
  "files": [],
  "tasks": [],
  "docker": {"enabled": false},
  "detect": {
    "mode": "any",
    "priority": 60,
    "probes": [
      {"type": "service", "value": "beszel.service"},
      {"type": "service", "value": "beszel-hub.service"}
    ]
  },
  "test_service": "beszel-test",
  "notes": ["Journal only; agent units are intentionally excluded from detection because they are installed across application containers."]
}
