{
  "schema_version": 1,
  "profile_revision": 1,
  "name": "transmission",
  "description": "Transmission journal logging",
  "journal": true,
  "required_paths": [],
  "files": [],
  "tasks": [],
  "docker": {"enabled": false},
  "detect": {
    "mode": "any",
    "priority": 60,
    "probes": [
      {"type": "service", "value": "transmission-daemon.service"},
      {"type": "service", "value": "transmission.service"},
      {"type": "package", "value": "transmission-daemon"}
    ]
  },
  "test_service": "transmission-test",
  "notes": ["Journal only."]
}
