{
  "schema_version": 1,
  "profile_revision": 1,
  "name": "birdnetgo",
  "description": "BirdNET-Go journal logging",
  "journal": true,
  "required_paths": [],
  "files": [],
  "tasks": [],
  "docker": {"enabled": false},
  "detect": {"mode": "any", "priority": 60, "probes": [{"type": "service", "value": "birdnet-go.service"}, {"type": "service", "value": "birdnetgo.service"}]},
  "test_service": "birdnetgo-test",
  "notes": ["Journal only for v1."]
}
